question_type	question_text	required	page_number	option_text	option_values
instruction	Welcome to this survey. Press <strong>Next</strong> to begin.	0	1		
instruction	For each of the following statements, please indicate the <strong>likelihood</strong> that you would engage in the described activity or behavior if you were to find yourself in that situation.  <br><br>Provide a rating from Extremely Unlikely to Extremely Likely, using the following scale: <ul list-text><li> (1) Extremely Unlikely </li><li> (2) Moderately Unlikely </li><li> (3) Somewhat Unlikely </li><li> (4) Not Sure </li><li> (5) Somewhat Likely </li><li> (6) Moderately Likely</li><li> (7) Extremely Likely </li></ul>	0	2		
radio	Admitting that your tastes are different from those of a friend.	1	3	Extremely Unlikely: 1, 2, 3, Not sure: 4, 5, 6, Extremely Likely: 7	1,2,3,4,5,6,7
radio	Disagreeing with an authority figure on a major issue.	1	3	Extremely Unlikely: 1, 2, 3, Not sure: 4, 5, 6, Extremely Likely: 7	1,2,3,4,5,6,7
radio	Choosing a career that you truly enjoy over a more secure one.	1	3	Extremely Unlikely: 1, 2, 3, Not sure: 4, 5, 6, Extremely Likely: 7	1,2,3,4,5,6,7
radio	Speaking your mind about an unpopular issue in a meeting at work.	1	3	Extremely Unlikely: 1, 2, 3, Not sure: 4, 5, 6, Extremely Likely: 7	1,2,3,4,5,6,7
radio	Moving to a city far away from your extended family.	1	3	Extremely Unlikely: 1, 2, 3, Not sure: 4, 5, 6, Extremely Likely: 7	1,2,3,4,5,6,7
radio	Starting a new career in your mid-thirties.	1	3	Extremely Unlikely: 1, 2, 3, Not sure: 4, 5, 6, Extremely Likely: 7	1,2,3,4,5,6,7
instruction	Congratulations for completing this survey! Press <strong>finish</strong> to continue.	0	4	
